{
	"$schema": "../../../../docs/schemas/manifest.schema.json",
	"type": "scene",
	"slug": "example-scene",
	"name": "Example Scene",
	"label": "Example",
	"version": "1.0.0",
	"author": "ODD Example",
	"description": "Minimal valid scene manifest used by CI to exercise the JSON Schema.",
	"entry": "scene.js",
	"preview": "preview.webp",
	"wallpaper": "wallpaper.webp",
	"fallbackColor": "#0a0a1f",
	"tags": ["example", "generative"]
}
