{
	"$schema": "../../../docs/schemas/manifest.schema.json",
	"type": "icon-set",
	"slug": "example-iconset",
	"name": "Example Icon Set",
	"label": "Example",
	"version": "1.0.0",
	"accent": "#6a5cff",
	"icons": {
		"dashboard":  "dashboard.webp",
		"posts":      "posts.webp",
		"pages":      "pages.webp",
		"media":      "media.webp",
		"comments":   "comments.webp",
		"appearance": "appearance.webp",
		"plugins":    "plugins.webp",
		"users":      "users.webp",
		"tools":      "tools.webp",
		"settings":   "settings.webp",
		"os-settings": "os-settings.webp",
		"import":     "import.webp",
		"classic-admin": "classic-admin.webp",
		"profile":    "profile.webp",
		"links":      "links.webp",
		"recycle-bin": "recycle-bin.webp",
		"fallback":   "fallback.webp"
	}
}
